{
  "tool": "os-validate",
  "status": "ok",
  "durationMs": 8420,
  "checks": [
    { "name": "verify-runtime-budget", "status": "ok", "detail": "" },
    { "name": "verify-context-economy", "status": "ok", "detail": "" },
    { "name": "verify-script-manifest", "status": "ok", "detail": "" },
    { "name": "verify-doc-contract-consistency", "status": "ok", "detail": "" },
    { "name": "verify-skills-manifest", "status": "ok", "detail": "" },
    { "name": "verify-skills-structure", "status": "ok", "detail": "" },
    { "name": "verify-json-contracts", "status": "ok", "detail": "" }
  ],
  "warnings": [],
  "failures": [],
  "findings": [{ "profile": "quick" }],
  "actions": []
}
